{
  "schemaVersion": "1.0.0",
  "generatedAt": "2026-05-08T18:23:57.091256Z",
  "sources": [
    {
      "source": "national/general",
      "url": "https://mock-national/general.com",
      "status": "OK",
      "itemsFetched": 2,
      "itemsAccepted": 2,
      "itemsDropped": 0,
      "latencyMs": 150,
      "message": "Success",
      "dropReasons": {}
    },
    {
      "source": "business/markets",
      "url": "https://mock-business/markets.com",
      "status": "OK",
      "itemsFetched": 2,
      "itemsAccepted": 2,
      "itemsDropped": 0,
      "latencyMs": 150,
      "message": "Success",
      "dropReasons": {}
    },
    {
      "source": "world/context",
      "url": "https://mock-world/context.com",
      "status": "OK",
      "itemsFetched": 2,
      "itemsAccepted": 2,
      "itemsDropped": 0,
      "latencyMs": 150,
      "message": "Success",
      "dropReasons": {}
    },
    {
      "source": "local Chennai",
      "url": "https://mock-local Chennai.com",
      "status": "OK",
      "itemsFetched": 2,
      "itemsAccepted": 2,
      "itemsDropped": 0,
      "latencyMs": 150,
      "message": "Success",
      "dropReasons": {}
    },
    {
      "source": "local Trichy",
      "url": "https://mock-local Trichy.com",
      "status": "OK",
      "itemsFetched": 2,
      "itemsAccepted": 2,
      "itemsDropped": 0,
      "latencyMs": 150,
      "message": "Success",
      "dropReasons": {}
    },
    {
      "source": "Oman/Muscat",
      "url": "https://mock-Oman/Muscat.com",
      "status": "OK",
      "itemsFetched": 2,
      "itemsAccepted": 2,
      "itemsDropped": 0,
      "latencyMs": 150,
      "message": "Success",
      "dropReasons": {}
    },
    {
      "source": "Google News supplements",
      "url": "https://mock-Google News supplements.com",
      "status": "OK",
      "itemsFetched": 2,
      "itemsAccepted": 2,
      "itemsDropped": 0,
      "latencyMs": 150,
      "message": "Success",
      "dropReasons": {}
    }
  ],
  "sections": {}
}